{
  "$schema": "../pack.schema.json",
  "id": "real_estate",
  "version": 2,
  "status": "preview",
  "default_for_existing_workspaces": false,
  "reviewed_by": null,
  "names": {
    "en": "Real estate",
    "te": "రియల్ ఎస్టేట్",
    "hi": "रियल एस्टेट",
    "kn": "ರಿಯಲ್ ಎಸ್ಟೇಟ್"
  },
  "summary": {
    "en": "Builders, agents and developers: flats, villas, plots, rentals",
    "te": "బిల్డర్లు, ఏజెంట్లు: flats, villas, plots, rentals",
    "hi": "बिल्डर, एजेंट: flats, villas, plots, rentals",
    "kn": "ಬಿಲ್ಡರ್, ಏಜೆಂಟ್: flats, villas, plots, rentals"
  },
  "accent": "leads_orange",
  "owl_prop": "building",
  "core_tab": "campaigns",
  "modules": [
    "today",
    "inbox",
    "contacts",
    "enquiries",
    "followups",
    "visits",
    "campaigns",
    "call_list",
    "voice_notes",
    "reports",
    "office",
    "integrations"
  ],
  "units": [],
  "default_unit": null,
  "labels": {
    "en": {
      "nav.item.today": "Today",
      "nav.item.leads": "Leads",
      "nav.item.quotes": "Quotes",
      "nav.item.orders": "Orders",
      "nav.item.customers": "Buyers",
      "nav.item.catalogue": "Offers",
      "nav.item.sarees": "Offers",
      "nav.item.visits": "Site visits",
      "nav.tab.visits": "Site visits",
      "nav.item.chats": "Customer chats",
      "nav.item.retailers": "Leads",
      "nav.item.report": "This week",
      "nav.item.team": "Team",
      "nav.item.office": "Office",
      "nav.item.integrations": "Integrations",
      "nav.item.settings": "Settings",
      "agent.lead_finder": "Lead Desk",
      "agent.researcher": "Researcher",
      "agent.requirement_analyst": "Enquiry Analyst",
      "agent.quote_writer": "Quote Writer",
      "agent.followup_desk": "Follow-up Desk",
      "agent.order_desk": "Order Desk",
      "word.customer": "Buyer",
      "word.customers": "Buyers",
      "word.lead": "Lead",
      "word.leads": "Leads",
      "word.enquiry": "Enquiry",
      "word.enquiries": "Enquiries",
      "word.item": "Offer",
      "word.items": "Offers",
      "word.quote": "Quote",
      "word.quotes": "Quotes",
      "word.order": "Order",
      "word.orders": "Orders",
      "word.visit": "Site visit",
      "word.visits": "Site visits",
      "word.contact": "Contact",
      "word.contacts": "Contacts",
      "pack.core_tab": "Campaigns",
      "pack.not_validated": "Not validated by a real owner yet"
    }
  },
  "language_review": {
    "te": "draft",
    "hi": "draft",
    "kn": "draft"
  },
  "custom_fields": [
    {
      "entity": "contact",
      "code": "preferred_language",
      "kind": "choice",
      "label": {
        "en": "Language for calls and messages"
      },
      "required": false,
      "pii_class": "none",
      "mergeable": true,
      "choices": [
        {
          "code": "en",
          "label": {
            "en": "English"
          }
        },
        {
          "code": "te",
          "label": {
            "en": "Telugu"
          }
        },
        {
          "code": "hi",
          "label": {
            "en": "Hindi"
          }
        },
        {
          "code": "kn",
          "label": {
            "en": "Kannada"
          }
        },
        {
          "code": "ta",
          "label": {
            "en": "Tamil"
          }
        },
        {
          "code": "ml",
          "label": {
            "en": "Malayalam"
          }
        }
      ]
    },
    {
      "entity": "contact",
      "code": "best_time_to_call",
      "kind": "choice",
      "label": {
        "en": "Best time to call"
      },
      "required": false,
      "pii_class": "none",
      "mergeable": true,
      "choices": [
        {
          "code": "morning",
          "label": {
            "en": "Morning"
          }
        },
        {
          "code": "afternoon",
          "label": {
            "en": "Afternoon"
          }
        },
        {
          "code": "evening",
          "label": {
            "en": "Evening"
          }
        },
        {
          "code": "any",
          "label": {
            "en": "Any time"
          }
        }
      ]
    },
    {
      "entity": "contact",
      "code": "interest",
      "kind": "choice",
      "label": {
        "en": "Looking to"
      },
      "required": false,
      "pii_class": "none",
      "mergeable": true,
      "choices": [
        {
          "code": "buy",
          "label": {
            "en": "Buy"
          }
        },
        {
          "code": "rent",
          "label": {
            "en": "Rent"
          }
        },
        {
          "code": "invest",
          "label": {
            "en": "Invest"
          }
        }
      ]
    },
    {
      "entity": "contact",
      "code": "property_type",
      "kind": "choice",
      "label": {
        "en": "Property type"
      },
      "required": false,
      "pii_class": "none",
      "mergeable": true,
      "choices": [
        {
          "code": "flat",
          "label": {
            "en": "Flat or apartment"
          }
        },
        {
          "code": "villa",
          "label": {
            "en": "Villa or independent house"
          }
        },
        {
          "code": "plot",
          "label": {
            "en": "Plot"
          }
        },
        {
          "code": "commercial",
          "label": {
            "en": "Commercial space"
          }
        }
      ]
    },
    {
      "entity": "contact",
      "code": "budget_band",
      "kind": "choice",
      "label": {
        "en": "Budget"
      },
      "required": false,
      "pii_class": "none",
      "mergeable": true,
      "choices": [
        {
          "code": "under_30l",
          "label": {
            "en": "Under 30 lakh"
          }
        },
        {
          "code": "30_60l",
          "label": {
            "en": "30 to 60 lakh"
          }
        },
        {
          "code": "60l_1cr",
          "label": {
            "en": "60 lakh to 1 crore"
          }
        },
        {
          "code": "1_2cr",
          "label": {
            "en": "1 to 2 crore"
          }
        },
        {
          "code": "above_2cr",
          "label": {
            "en": "Above 2 crore"
          }
        }
      ]
    },
    {
      "entity": "contact",
      "code": "preferred_area",
      "kind": "text",
      "label": {
        "en": "Preferred area or locality"
      },
      "required": false,
      "pii_class": "none",
      "mergeable": true
    },
    {
      "entity": "contact",
      "code": "timeline",
      "kind": "choice",
      "label": {
        "en": "When do they want to decide"
      },
      "required": false,
      "pii_class": "none",
      "mergeable": true,
      "choices": [
        {
          "code": "now",
          "label": {
            "en": "Right now"
          }
        },
        {
          "code": "one_three_months",
          "label": {
            "en": "In 1 to 3 months"
          }
        },
        {
          "code": "three_six_months",
          "label": {
            "en": "In 3 to 6 months"
          }
        },
        {
          "code": "later",
          "label": {
            "en": "Later"
          }
        }
      ]
    },
    {
      "entity": "contact",
      "code": "financing",
      "kind": "choice",
      "label": {
        "en": "How will they pay"
      },
      "required": false,
      "pii_class": "none",
      "mergeable": true,
      "choices": [
        {
          "code": "own_funds",
          "label": {
            "en": "Own funds"
          }
        },
        {
          "code": "home_loan",
          "label": {
            "en": "Home loan"
          }
        },
        {
          "code": "not_sure",
          "label": {
            "en": "Not sure yet"
          }
        }
      ]
    },
    {
      "entity": "contact",
      "code": "site_visit_day",
      "kind": "date",
      "label": {
        "en": "Site visit day"
      },
      "required": false,
      "pii_class": "none",
      "mergeable": true
    }
  ],
  "example_data": {}
}
