{
  "$schema": "../pack.schema.json",
  "id": "interiors_solar",
  "version": 2,
  "status": "preview",
  "default_for_existing_workspaces": false,
  "reviewed_by": null,
  "names": {
    "en": "Interiors and solar",
    "te": "ఇంటీరియర్స్, సోలార్",
    "hi": "इंटीरियर और सोलर",
    "kn": "ಇಂಟೀರಿಯರ್, ಸೋಲಾರ್"
  },
  "summary": {
    "en": "Interior designers, kitchens and wardrobes, rooftop solar installers",
    "te": "Interior designers, kitchens, wardrobes, rooftop solar",
    "hi": "Interior designers, kitchens, wardrobes, rooftop solar",
    "kn": "Interior designers, kitchens, wardrobes, rooftop solar"
  },
  "accent": "leads_orange",
  "owl_prop": "sofa_sun",
  "core_tab": "campaigns",
  "modules": [
    "today",
    "inbox",
    "contacts",
    "enquiries",
    "followups",
    "visits",
    "campaigns",
    "call_list",
    "voice_notes",
    "reports",
    "office",
    "integrations"
  ],
  "units": [],
  "default_unit": null,
  "labels": {
    "en": {
      "nav.item.today": "Today",
      "nav.item.leads": "Leads",
      "nav.item.quotes": "Quotes",
      "nav.item.orders": "Orders",
      "nav.item.customers": "Clients",
      "nav.item.catalogue": "Offers",
      "nav.item.sarees": "Offers",
      "nav.item.visits": "Site measurements",
      "nav.tab.visits": "Site measurements",
      "nav.item.chats": "Customer chats",
      "nav.item.retailers": "Leads",
      "nav.item.report": "This week",
      "nav.item.team": "Team",
      "nav.item.office": "Office",
      "nav.item.integrations": "Integrations",
      "nav.item.settings": "Settings",
      "agent.lead_finder": "Lead Desk",
      "agent.researcher": "Researcher",
      "agent.requirement_analyst": "Enquiry Analyst",
      "agent.quote_writer": "Quote Writer",
      "agent.followup_desk": "Follow-up Desk",
      "agent.order_desk": "Order Desk",
      "word.customer": "Client",
      "word.customers": "Clients",
      "word.lead": "Lead",
      "word.leads": "Leads",
      "word.enquiry": "Enquiry",
      "word.enquiries": "Enquiries",
      "word.item": "Offer",
      "word.items": "Offers",
      "word.quote": "Quote",
      "word.quotes": "Quotes",
      "word.order": "Order",
      "word.orders": "Orders",
      "word.visit": "Site measurement",
      "word.visits": "Site measurements",
      "word.contact": "Contact",
      "word.contacts": "Contacts",
      "pack.core_tab": "Campaigns",
      "pack.not_validated": "Not validated by a real owner yet"
    }
  },
  "language_review": {
    "te": "draft",
    "hi": "draft",
    "kn": "draft"
  },
  "custom_fields": [
    {
      "entity": "contact",
      "code": "preferred_language",
      "kind": "choice",
      "label": {
        "en": "Language for calls and messages"
      },
      "required": false,
      "pii_class": "none",
      "mergeable": true,
      "choices": [
        {
          "code": "en",
          "label": {
            "en": "English"
          }
        },
        {
          "code": "te",
          "label": {
            "en": "Telugu"
          }
        },
        {
          "code": "hi",
          "label": {
            "en": "Hindi"
          }
        },
        {
          "code": "kn",
          "label": {
            "en": "Kannada"
          }
        },
        {
          "code": "ta",
          "label": {
            "en": "Tamil"
          }
        },
        {
          "code": "ml",
          "label": {
            "en": "Malayalam"
          }
        }
      ]
    },
    {
      "entity": "contact",
      "code": "best_time_to_call",
      "kind": "choice",
      "label": {
        "en": "Best time to call"
      },
      "required": false,
      "pii_class": "none",
      "mergeable": true,
      "choices": [
        {
          "code": "morning",
          "label": {
            "en": "Morning"
          }
        },
        {
          "code": "afternoon",
          "label": {
            "en": "Afternoon"
          }
        },
        {
          "code": "evening",
          "label": {
            "en": "Evening"
          }
        },
        {
          "code": "any",
          "label": {
            "en": "Any time"
          }
        }
      ]
    },
    {
      "entity": "contact",
      "code": "service",
      "kind": "choice",
      "label": {
        "en": "Service of interest"
      },
      "required": false,
      "pii_class": "none",
      "mergeable": true,
      "choices": [
        {
          "code": "modular_kitchen",
          "label": {
            "en": "Modular kitchen"
          }
        },
        {
          "code": "home_interiors",
          "label": {
            "en": "Full home interiors"
          }
        },
        {
          "code": "wardrobes",
          "label": {
            "en": "Wardrobes"
          }
        },
        {
          "code": "rooftop_solar",
          "label": {
            "en": "Rooftop solar"
          }
        },
        {
          "code": "solar_water_heater",
          "label": {
            "en": "Solar water heater"
          }
        },
        {
          "code": "other",
          "label": {
            "en": "Other"
          }
        }
      ]
    },
    {
      "entity": "contact",
      "code": "property_type",
      "kind": "choice",
      "label": {
        "en": "Property type"
      },
      "required": false,
      "pii_class": "none",
      "mergeable": true,
      "choices": [
        {
          "code": "apartment",
          "label": {
            "en": "Apartment"
          }
        },
        {
          "code": "independent_house",
          "label": {
            "en": "Independent house"
          }
        },
        {
          "code": "villa",
          "label": {
            "en": "Villa"
          }
        },
        {
          "code": "commercial",
          "label": {
            "en": "Commercial"
          }
        }
      ]
    },
    {
      "entity": "contact",
      "code": "property_status",
      "kind": "choice",
      "label": {
        "en": "Property status"
      },
      "required": false,
      "pii_class": "none",
      "mergeable": true,
      "choices": [
        {
          "code": "ready",
          "label": {
            "en": "Ready to move in"
          }
        },
        {
          "code": "under_construction",
          "label": {
            "en": "Under construction"
          }
        },
        {
          "code": "occupied",
          "label": {
            "en": "Already living there"
          }
        }
      ]
    },
    {
      "entity": "contact",
      "code": "budget_band",
      "kind": "choice",
      "label": {
        "en": "Budget"
      },
      "required": false,
      "pii_class": "none",
      "mergeable": true,
      "choices": [
        {
          "code": "small",
          "label": {
            "en": "Small"
          }
        },
        {
          "code": "medium",
          "label": {
            "en": "Medium"
          }
        },
        {
          "code": "large",
          "label": {
            "en": "Large"
          }
        },
        {
          "code": "not_sure",
          "label": {
            "en": "Not sure"
          }
        }
      ]
    },
    {
      "entity": "contact",
      "code": "start_timeline",
      "kind": "choice",
      "label": {
        "en": "When do they want to start"
      },
      "required": false,
      "pii_class": "none",
      "mergeable": true,
      "choices": [
        {
          "code": "now",
          "label": {
            "en": "Right away"
          }
        },
        {
          "code": "one_three_months",
          "label": {
            "en": "In 1 to 3 months"
          }
        },
        {
          "code": "later",
          "label": {
            "en": "Later"
          }
        }
      ]
    },
    {
      "entity": "contact",
      "code": "area_text",
      "kind": "text",
      "label": {
        "en": "Area or locality"
      },
      "required": false,
      "pii_class": "none",
      "mergeable": true
    },
    {
      "entity": "contact",
      "code": "measurement_day",
      "kind": "date",
      "label": {
        "en": "Site measurement day"
      },
      "required": false,
      "pii_class": "none",
      "mergeable": true
    }
  ],
  "example_data": {}
}
