{
  "$schema": "../pack.schema.json",
  "id": "gym",
  "version": 1,
  "status": "preview",
  "default_for_existing_workspaces": false,
  "reviewed_by": null,
  "names": {
    "en": "Gym and fitness",
    "te": "జిమ్, ఫిట్‌నెస్",
    "hi": "जिम और फिटनेस",
    "kn": "ಜಿಮ್, ಫಿಟ್ನೆಸ್"
  },
  "summary": {
    "en": "Gyms, yoga and fitness studios: free trial sessions and memberships",
    "te": "Gyms, yoga, fitness studios: free trial, memberships",
    "hi": "Gyms, yoga, fitness studios: free trial, memberships",
    "kn": "Gyms, yoga, fitness studios: free trial, memberships"
  },
  "accent": "leads_orange",
  "owl_prop": "dumbbell",
  "core_tab": "campaigns",
  "modules": [
    "today",
    "inbox",
    "contacts",
    "enquiries",
    "followups",
    "visits",
    "campaigns",
    "call_list",
    "voice_notes",
    "reports",
    "office",
    "integrations"
  ],
  "units": [],
  "default_unit": null,
  "labels": {
    "en": {
      "nav.item.today": "Today",
      "nav.item.leads": "Leads",
      "nav.item.quotes": "Quotes",
      "nav.item.orders": "Orders",
      "nav.item.customers": "Members",
      "nav.item.catalogue": "Offers",
      "nav.item.sarees": "Offers",
      "nav.item.visits": "Trial sessions",
      "nav.tab.visits": "Trial sessions",
      "nav.item.chats": "Customer chats",
      "nav.item.retailers": "Find leads",
      "nav.item.report": "This week",
      "nav.item.team": "Team",
      "nav.item.office": "Office",
      "nav.item.integrations": "Integrations",
      "nav.item.settings": "Settings",
      "agent.lead_finder": "Lead Desk",
      "agent.researcher": "Researcher",
      "agent.requirement_analyst": "Enquiry Analyst",
      "agent.quote_writer": "Quote Writer",
      "agent.followup_desk": "Follow-up Desk",
      "agent.order_desk": "Order Desk",
      "word.customer": "Member",
      "word.customers": "Members",
      "word.lead": "Lead",
      "word.leads": "Leads",
      "word.enquiry": "Enquiry",
      "word.enquiries": "Enquiries",
      "word.item": "Offer",
      "word.items": "Offers",
      "word.quote": "Quote",
      "word.quotes": "Quotes",
      "word.order": "Order",
      "word.orders": "Orders",
      "word.visit": "Trial session",
      "word.visits": "Trial sessions",
      "word.contact": "Contact",
      "word.contacts": "Contacts",
      "pack.core_tab": "Campaigns",
      "pack.not_validated": "Not validated by a real owner yet"
    }
  },
  "language_review": {
    "te": "draft",
    "hi": "draft",
    "kn": "draft"
  },
  "custom_fields": [
    {
      "entity": "contact",
      "code": "preferred_language",
      "kind": "choice",
      "label": {
        "en": "Language for calls and messages"
      },
      "required": false,
      "pii_class": "none",
      "mergeable": true,
      "choices": [
        {
          "code": "en",
          "label": {
            "en": "English"
          }
        },
        {
          "code": "te",
          "label": {
            "en": "Telugu"
          }
        },
        {
          "code": "hi",
          "label": {
            "en": "Hindi"
          }
        },
        {
          "code": "kn",
          "label": {
            "en": "Kannada"
          }
        },
        {
          "code": "ta",
          "label": {
            "en": "Tamil"
          }
        },
        {
          "code": "ml",
          "label": {
            "en": "Malayalam"
          }
        }
      ]
    },
    {
      "entity": "contact",
      "code": "best_time_to_call",
      "kind": "choice",
      "label": {
        "en": "Best time to call"
      },
      "required": false,
      "pii_class": "none",
      "mergeable": true,
      "choices": [
        {
          "code": "morning",
          "label": {
            "en": "Morning"
          }
        },
        {
          "code": "afternoon",
          "label": {
            "en": "Afternoon"
          }
        },
        {
          "code": "evening",
          "label": {
            "en": "Evening"
          }
        },
        {
          "code": "any",
          "label": {
            "en": "Any time"
          }
        }
      ]
    },
    {
      "entity": "contact",
      "code": "fitness_goal",
      "kind": "choice",
      "label": {
        "en": "Main goal"
      },
      "required": false,
      "pii_class": "none",
      "mergeable": true,
      "choices": [
        {
          "code": "weight_loss",
          "label": {
            "en": "Weight loss"
          }
        },
        {
          "code": "muscle_gain",
          "label": {
            "en": "Muscle gain"
          }
        },
        {
          "code": "general_fitness",
          "label": {
            "en": "General fitness"
          }
        },
        {
          "code": "sports",
          "label": {
            "en": "Sports performance"
          }
        },
        {
          "code": "flexibility",
          "label": {
            "en": "Flexibility or yoga"
          }
        }
      ]
    },
    {
      "entity": "contact",
      "code": "experience",
      "kind": "choice",
      "label": {
        "en": "Experience"
      },
      "required": false,
      "pii_class": "none",
      "mergeable": true,
      "choices": [
        {
          "code": "beginner",
          "label": {
            "en": "Beginner"
          }
        },
        {
          "code": "some",
          "label": {
            "en": "Some experience"
          }
        },
        {
          "code": "regular",
          "label": {
            "en": "Regular"
          }
        }
      ]
    },
    {
      "entity": "contact",
      "code": "preferred_slot",
      "kind": "choice",
      "label": {
        "en": "Preferred time"
      },
      "required": false,
      "pii_class": "none",
      "mergeable": true,
      "choices": [
        {
          "code": "morning",
          "label": {
            "en": "Morning"
          }
        },
        {
          "code": "afternoon",
          "label": {
            "en": "Afternoon"
          }
        },
        {
          "code": "evening",
          "label": {
            "en": "Evening"
          }
        }
      ]
    },
    {
      "entity": "contact",
      "code": "plan_interest",
      "kind": "choice",
      "label": {
        "en": "Plan of interest"
      },
      "required": false,
      "pii_class": "none",
      "mergeable": true,
      "choices": [
        {
          "code": "monthly",
          "label": {
            "en": "Monthly"
          }
        },
        {
          "code": "quarterly",
          "label": {
            "en": "Quarterly"
          }
        },
        {
          "code": "annual",
          "label": {
            "en": "Annual"
          }
        },
        {
          "code": "not_sure",
          "label": {
            "en": "Not sure"
          }
        }
      ]
    },
    {
      "entity": "contact",
      "code": "area_text",
      "kind": "text",
      "label": {
        "en": "Area they live or work in"
      },
      "required": false,
      "pii_class": "none",
      "mergeable": true
    },
    {
      "entity": "contact",
      "code": "trial_day",
      "kind": "date",
      "label": {
        "en": "Trial day"
      },
      "required": false,
      "pii_class": "none",
      "mergeable": true
    }
  ],
  "example_data": {}
}
