{
  "$schema": "../pack.schema.json",
  "id": "insurance_loans",
  "version": 2,
  "status": "preview",
  "default_for_existing_workspaces": false,
  "reviewed_by": null,
  "names": {
    "en": "Insurance and loans",
    "te": "ఇన్సూరెన్స్, లోన్లు",
    "hi": "इंश्योरेंस और लोन",
    "kn": "ಇನ್ಶೂರೆನ್ಸ್, ಸಾಲ"
  },
  "summary": {
    "en": "Insurance agents, loan and finance advisors: qualify and book a call",
    "te": "Insurance agents, loan advisors: qualify చేసి call book",
    "hi": "Insurance agents, loan advisors: qualify करके call book",
    "kn": "Insurance agents, loan advisors: qualify ಮಾಡಿ call book"
  },
  "accent": "leads_orange",
  "owl_prop": "shield_check",
  "core_tab": "campaigns",
  "modules": [
    "today",
    "inbox",
    "contacts",
    "enquiries",
    "followups",
    "visits",
    "campaigns",
    "call_list",
    "voice_notes",
    "reports",
    "office",
    "integrations"
  ],
  "units": [],
  "default_unit": null,
  "labels": {
    "en": {
      "nav.item.today": "Today",
      "nav.item.leads": "Leads",
      "nav.item.quotes": "Quotes",
      "nav.item.orders": "Orders",
      "nav.item.customers": "Clients",
      "nav.item.catalogue": "Offers",
      "nav.item.sarees": "Offers",
      "nav.item.visits": "Advisor calls",
      "nav.tab.visits": "Advisor calls",
      "nav.item.chats": "Customer chats",
      "nav.item.retailers": "Leads",
      "nav.item.report": "This week",
      "nav.item.team": "Team",
      "nav.item.office": "Office",
      "nav.item.integrations": "Integrations",
      "nav.item.settings": "Settings",
      "agent.lead_finder": "Lead Desk",
      "agent.researcher": "Researcher",
      "agent.requirement_analyst": "Enquiry Analyst",
      "agent.quote_writer": "Quote Writer",
      "agent.followup_desk": "Follow-up Desk",
      "agent.order_desk": "Order Desk",
      "word.customer": "Client",
      "word.customers": "Clients",
      "word.lead": "Lead",
      "word.leads": "Leads",
      "word.enquiry": "Enquiry",
      "word.enquiries": "Enquiries",
      "word.item": "Offer",
      "word.items": "Offers",
      "word.quote": "Quote",
      "word.quotes": "Quotes",
      "word.order": "Order",
      "word.orders": "Orders",
      "word.visit": "Advisor call",
      "word.visits": "Advisor calls",
      "word.contact": "Contact",
      "word.contacts": "Contacts",
      "pack.core_tab": "Campaigns",
      "pack.not_validated": "Not validated by a real owner yet"
    }
  },
  "language_review": {
    "te": "draft",
    "hi": "draft",
    "kn": "draft"
  },
  "custom_fields": [
    {
      "entity": "contact",
      "code": "preferred_language",
      "kind": "choice",
      "label": {
        "en": "Language for calls and messages"
      },
      "required": false,
      "pii_class": "none",
      "mergeable": true,
      "choices": [
        {
          "code": "en",
          "label": {
            "en": "English"
          }
        },
        {
          "code": "te",
          "label": {
            "en": "Telugu"
          }
        },
        {
          "code": "hi",
          "label": {
            "en": "Hindi"
          }
        },
        {
          "code": "kn",
          "label": {
            "en": "Kannada"
          }
        },
        {
          "code": "ta",
          "label": {
            "en": "Tamil"
          }
        },
        {
          "code": "ml",
          "label": {
            "en": "Malayalam"
          }
        }
      ]
    },
    {
      "entity": "contact",
      "code": "best_time_to_call",
      "kind": "choice",
      "label": {
        "en": "Best time to call"
      },
      "required": false,
      "pii_class": "none",
      "mergeable": true,
      "choices": [
        {
          "code": "morning",
          "label": {
            "en": "Morning"
          }
        },
        {
          "code": "afternoon",
          "label": {
            "en": "Afternoon"
          }
        },
        {
          "code": "evening",
          "label": {
            "en": "Evening"
          }
        },
        {
          "code": "any",
          "label": {
            "en": "Any time"
          }
        }
      ]
    },
    {
      "entity": "contact",
      "code": "product",
      "kind": "choice",
      "label": {
        "en": "Product of interest"
      },
      "required": false,
      "pii_class": "none",
      "mergeable": true,
      "choices": [
        {
          "code": "term_life",
          "label": {
            "en": "Term life insurance"
          }
        },
        {
          "code": "health",
          "label": {
            "en": "Health insurance"
          }
        },
        {
          "code": "motor",
          "label": {
            "en": "Motor insurance"
          }
        },
        {
          "code": "home_loan",
          "label": {
            "en": "Home loan"
          }
        },
        {
          "code": "personal_loan",
          "label": {
            "en": "Personal loan"
          }
        },
        {
          "code": "business_loan",
          "label": {
            "en": "Business loan"
          }
        },
        {
          "code": "other",
          "label": {
            "en": "Other"
          }
        }
      ]
    },
    {
      "entity": "contact",
      "code": "need_band",
      "kind": "choice",
      "label": {
        "en": "Amount needed"
      },
      "required": false,
      "pii_class": "none",
      "mergeable": true,
      "choices": [
        {
          "code": "small",
          "label": {
            "en": "Small"
          }
        },
        {
          "code": "medium",
          "label": {
            "en": "Medium"
          }
        },
        {
          "code": "large",
          "label": {
            "en": "Large"
          }
        },
        {
          "code": "not_sure",
          "label": {
            "en": "Not sure"
          }
        }
      ]
    },
    {
      "entity": "contact",
      "code": "employment",
      "kind": "choice",
      "label": {
        "en": "Work type"
      },
      "required": false,
      "pii_class": "none",
      "mergeable": true,
      "choices": [
        {
          "code": "salaried",
          "label": {
            "en": "Salaried"
          }
        },
        {
          "code": "self_employed",
          "label": {
            "en": "Self-employed"
          }
        },
        {
          "code": "business_owner",
          "label": {
            "en": "Business owner"
          }
        },
        {
          "code": "other",
          "label": {
            "en": "Other"
          }
        }
      ]
    },
    {
      "entity": "contact",
      "code": "has_existing_cover",
      "kind": "yes_no",
      "label": {
        "en": "Has an existing policy or loan for this"
      },
      "required": false,
      "pii_class": "none",
      "mergeable": false
    },
    {
      "entity": "contact",
      "code": "city_text",
      "kind": "text",
      "label": {
        "en": "City"
      },
      "required": false,
      "pii_class": "none",
      "mergeable": true
    },
    {
      "entity": "contact",
      "code": "advisor_call_day",
      "kind": "date",
      "label": {
        "en": "Advisor call day"
      },
      "required": false,
      "pii_class": "none",
      "mergeable": true
    }
  ],
  "example_data": {}
}
